"Una fuente vinculada a la empresa aseguró a Elimpulso.com que la oficina de la Cantv en Carora atraviesa una severa crisis por falta de personal y de vehículos operativos para cubrir las demandas del servicio telefónico e internet en el municipio Torres. Afirmó ademas serían dos mil averías, aunado a un acentuado deterioro de equipos ante la desinversión de reposición y modernización de los sistemas para optimizar sus operaciones en beneficio de sus suscriptores, otras de las causas de la crisis de la compañía estatal de telecomunicaciones. Dijo que insólitamente varios teléfonos residenciales y comerciales de diversas zonas de Carora repentinamente se quedan sin tono a media mañana todos los días al recalentarse un equipo por falta de unaire acondicionado en la oficina ubicada en la calle Carabobo de dicha ciudad. “Esta situación afecta en los hogares la comunicación mediante llamadas telefónicas así como la internet, mientras los locales comerciales quedan sin el servicio de puntos de venta, acarreando problemas a las familias para comprar alimentos”, afirmó la fuente. “La solución a estos graves inconvenientes pasa por un permanente mantenimiento preventivo y correctivo por parte del estado venezolano, indicó la fuente, pero para ello se requiere tener voluntad y el desembolso de mucho dinero”, agregó. Explicó que “hace años atrás la Cantv cubría todos los sectores de la sociedad de manera eficiente porque era una empresa robusta y daba respuestas, pero actualmente solo atiende el área de salud y comercio siempre y cuando haya gasolina, el resto debe esperar”. En este sentido, manifestó que “siendo una empresa de telecomunicaciones del Estado, no es prioridad en las estaciones de servicio de Carora para equipar de gasolina la única camioneta con la que cuentan la cual estuvo accidentada por batería, de once que tenían, donde les piden una autorización de gerencia”. Advirtió de la existencia de empresas que de forma “fraudulenta” cobran para realizar supuestas reparaciones en diversos sectores de Carora que por no tener conocimientos de las tecnologías de Cantv lo que hacen es ocasionarles más daños severos a las redes instaladas, ya que manipulan los empalmes perjudicando a decenas de suscriptores. En este particular hace un llamado a denunciar este tipo de actos delictivos en el comando de la Guardia Nacional. Recordó que una persona fue detenida y está recluida en el comando de la Guardia Nacional por llevar a cabo aparentes reparaciones a la red pública de Cantv en Carora, por los cuales cobraba altas cifras en dólares hasta que fue denunciado y capturado. Por último invitó a reportar cualquier falla en la página web de Cantv, en la opción reporte de avería. Pretenden politizar la empresa  La fuente habló sobre la creación en Carora de una figura que la han llamado Órgano Superior de las Telecomunicaciones, en la que vinculan la alcaldía socialista de Torres. Sostuvo que en lugar de contribuir a solventar problemas de telecomunicaciones en apoyo a Cantv, se ha convertido en una estructura política que ignora la tecnología de la empresa. ",https://www.elimpulso.com/2020/08/13/aseguran-que-la-cantv-en-carora-esta-en-estado-agonico-13ago/
"Una fuente vinculada a la empresa aseguró a Elimpulso.com que la oficina de la Cantv en Carora atraviesa una severa crisis por falta de personal y de vehículos operativos para cubrir las demandas del servicio telefónico e internet en el municipio Torres. Afirmó ademas serían dos mil averías, aunado a un acentuado deterioro de equipos ante la desinversión de reposición y modernización de los sistemas para optimizar sus operaciones en beneficio de sus suscriptores, otras de las causas de la crisis de la compañía estatal de telecomunicaciones. Dijo que insólitamente varios teléfonos residenciales y comerciales de diversas zonas de Carora repentinamente se quedan sin tono a media mañana todos los días al recalentarse un equipo por falta de unaire acondicionado en la oficina ubicada en la calle Carabobo de dicha ciudad. “Esta situación afecta en los hogares la comunicación mediante llamadas telefónicas así como la internet, mientras los locales comerciales quedan sin el servicio de puntos de venta, acarreando problemas a las familias para comprar alimentos”, afirmó la fuente. “La solución a estos graves inconvenientes pasa por un permanente mantenimiento preventivo y correctivo por parte del estado venezolano, indicó la fuente, pero para ello se requiere tener voluntad y el desembolso de mucho dinero”, agregó. Explicó que “hace años atrás la Cantv cubría todos los sectores de la sociedad de manera eficiente porque era una empresa robusta y daba respuestas, pero actualmente solo atiende el área de salud y comercio siempre y cuando haya gasolina, el resto debe esperar”. En este sentido, manifestó que “siendo una empresa de telecomunicaciones del Estado, no es prioridad en las estaciones de servicio de Carora para equipar de gasolina la única camioneta con la que cuentan la cual estuvo accidentada por batería, de once que tenían, donde les piden una autorización de gerencia”. Advirtió de la existencia de empresas que de forma “fraudulenta” cobran para realizar supuestas reparaciones en diversos sectores de Carora que por no tener conocimientos de las tecnologías de Cantv lo que hacen es ocasionarles más daños severos a las redes instaladas, ya que manipulan los empalmes perjudicando a decenas de suscriptores. En este particular hace un llamado a denunciar este tipo de actos delictivos en el comando de la Guardia Nacional. Recordó que una persona fue detenida y está recluida en el comando de la Guardia Nacional por llevar a cabo aparentes reparaciones a la red pública de Cantv en Carora, por los cuales cobraba altas cifras en dólares hasta que fue denunciado y capturado. Por último invitó a reportar cualquier falla en la página web de Cantv, en la opción reporte de avería. Pretenden politizar la empresa  La fuente habló sobre la creación en Carora de una figura que la han llamado Órgano Superior de las Telecomunicaciones, en la que vinculan la alcaldía socialista de Torres. Sostuvo que en lugar de contribuir a solventar problemas de telecomunicaciones en apoyo a Cantv, se ha convertido en una estructura política que ignora la tecnología de la empresa. ",https://www.elimpulso.com/2020/08/13/aseguran-que-la-cantv-en-carora-esta-en-estado-agonico-13ago/
"Este domingo usuarios de las redes sociales expresaron su molestia por los cortes de luz que se ejecutaron el sábado en gran parte del municipio Palavecino por hasta 7 horas y un poco más. Los cabudareños estuvieron hasta la 1 de la mañana sin el servicio eléctrico. La situación de desidia que se vive con los servicios públicos en el estado Lara y en todo el país cada vez va en caída libre sin que haya una solución a la vista. Después de estar más del 25% del día sin luz, el servicio en algunos sectores de Palavecino se volvió a ver interrumpido cerca de las 7:25 de la mañana de este domingo. En Barquisimeto la situación no es diferente. Gran parte de la ciudad estuvo el sábado sin servicio eléctrico por más de 6 horas. Hasta los momentos ningún representante del régimen ha comentado alguna solución sobre el desastre que viven los venezolanos por los cortes de luz, entre otras vicisitudes que toca sortear diariamente. El racionamiento eléctrico de anoche en zonas de Barquisimeto y Cabudare fue de hasta siete horas (llegó tipo 1am).Y en algunas de esas zonas ya a las 7:25am de hoy domingo, la volvieron a quitar. Desboqueando un nuevo nivel de incompetencia, @CorpoelecLara1, @CORPOELECinfo, @gestionperfecta y @FreddyBritoM1 tienen a medio Barquisimeto y Cabudare sin electricidad desde la 7 de la mañana. 7 horas sin servicio eléctrico en Cabudare. @gestionperfecta por cuantas horas se le fué el servicio eléctrico?BASTA! Se pasaron @gestionperfecta y @CORPOELECinfo @CorpoelecLara1 dejaron sin luz a la mitad de Bqto h cabudare por 7 horas llegó a las 3 a.m que función tiene ahorrar energía en la madrugada ? Coñoetumadre te burlas de nosotros te crees invencible ! PARROQUIA AGUA VIVA en cabudare #sinluz a partir de las 7:20 am.. No fueron sufientes 8 horas sin luz, llego a las 3 am y se vuelve a ir a las 7:20am.. En lara no hay gobierno q solucione los problemas @JoseLuisYepez @gestionperfecta @elcitizen @elimpulsocom hasta cuándo nos quitarán la luz por más de 7 horas ya esto no se aguanta la gestión perfecta de Carmen Meléndez no sirve sin gas sin gasolina sin agua Cabudare sos ",https://www.elimpulso.com/2020/08/16/en-cabudare-llego-la-luz-a-las-3-am-y-a-las-7-de-la-manana-la-quitaron-otra-vez-16ago/
"La semana del 10 al 16 de agosto, mostró un aumento de los racionamientos en las comunidades de Barquisimeto y Cabudare. Los cortes en cada zona sumaron, en 86% de los casos, como mínimo, 15 horas sin luz. 24 de 38 comunidades (63%) reportaron más de 20 horas, según datos recabados por Elimpulso.com en colaboración con la sociedad civil Activos por la Luz @activosporlaluz. Esta semana El Kilovatín de Oro se muda a Barquisimeto, dándole el primer lugar a la zona de Tamaca, vía El Trapiche, Romeral I, II y III, por haber acumulado 35,75 horas sin luz por cortes diarios de 5 horas. Su día de racionamiento más extenso fue el sábado con 7 horas. En el segundo lugar se lo lleva el barrio la Peña, en Barquisimeto. Acumularon 34 horas en la semana sin luz, producto de 5 días de cortes inclementes de más de 7 horas. El sábado padecieron casi medio día, 10 horas, sin luz. Para completar el podio tenemos a una veterana de este premio, la zona de El Trompillo/El Carmen. Sumaron 33,28 horas sin fluido eléctrico y tuvieron que conformase con el tercer puesto, acosados de cerca por las comunidades de El Piñal, Pedregal, Parral, Fundalara Sur que obtuvieron 33,07. El sábado sufrieron doble tanda de cortes con 5 horas cada uno Como siempre, debemos aclarar que El Kilovatín de Oro solo destaca tres comunidades a la semana, pero no significa que el resto de las zonas de las ciudades no sufran cortes eléctricos. La semana pasada, habitantes de Barquisimeto y Cabudare reportaron que, a pesar de haber flexibilización de la cuarentena impuesta por el régimen, muchos comercios no podían laborar por los constantes y extensos recortes de energía. Cuando contaban con luz, las conexiones se caían y la banca por internet fallaba. El premio Kilovatín se otorga cada lunes. Es un galardón que nadie quiere ganarse, porque se entrega a la comunidad que ha sufrido más horas sin electricidad en la última semana. Usted puede postular su comunidad e informar cuántas horas se queda sin electricidad a través del Twitter en la cuenta @activosporlaluz. ",https://www.elimpulso.com/2020/08/18/infografiaimp-zonas-de-barquisimeto-fueron-las-mas-afectadas-por-cortes-de-luz-la-semana-pasada/
"La semana del 10 al 16 de agosto, mostró un aumento de los racionamientos en las comunidades de Barquisimeto y Cabudare. Los cortes en cada zona sumaron, en 86% de los casos, como mínimo, 15 horas sin luz. 24 de 38 comunidades (63%) reportaron más de 20 horas, según datos recabados por Elimpulso.com en colaboración con la sociedad civil Activos por la Luz @activosporlaluz. Esta semana El Kilovatín de Oro se muda a Barquisimeto, dándole el primer lugar a la zona de Tamaca, vía El Trapiche, Romeral I, II y III, por haber acumulado 35,75 horas sin luz por cortes diarios de 5 horas. Su día de racionamiento más extenso fue el sábado con 7 horas. En el segundo lugar se lo lleva el barrio la Peña, en Barquisimeto. Acumularon 34 horas en la semana sin luz, producto de 5 días de cortes inclementes de más de 7 horas. El sábado padecieron casi medio día, 10 horas, sin luz. Para completar el podio tenemos a una veterana de este premio, la zona de El Trompillo/El Carmen. Sumaron 33,28 horas sin fluido eléctrico y tuvieron que conformase con el tercer puesto, acosados de cerca por las comunidades de El Piñal, Pedregal, Parral, Fundalara Sur que obtuvieron 33,07. El sábado sufrieron doble tanda de cortes con 5 horas cada uno Como siempre, debemos aclarar que El Kilovatín de Oro solo destaca tres comunidades a la semana, pero no significa que el resto de las zonas de las ciudades no sufran cortes eléctricos. La semana pasada, habitantes de Barquisimeto y Cabudare reportaron que, a pesar de haber flexibilización de la cuarentena impuesta por el régimen, muchos comercios no podían laborar por los constantes y extensos recortes de energía. Cuando contaban con luz, las conexiones se caían y la banca por internet fallaba. El premio Kilovatín se otorga cada lunes. Es un galardón que nadie quiere ganarse, porque se entrega a la comunidad que ha sufrido más horas sin electricidad en la última semana. Usted puede postular su comunidad e informar cuántas horas se queda sin electricidad a través del Twitter en la cuenta @activosporlaluz. ",https://www.elimpulso.com/2020/08/18/infografiaimp-zonas-de-barquisimeto-fueron-las-mas-afectadas-por-cortes-de-luz-la-semana-pasada/
"Desde hace tres semanas los vecinos diversas comunidades de Cabudare no han visto los camiones recolectores del servicio de aseo urbano del Municipio Palavecino, lo que ha generado grandes cúmulos de basura dentro de las casas, aceras y avenidas de los urbanismos. La comunidades de La Puerta Norte y Sur, La Piedad, La Mora, El Trigal, Almarriera y El Recreo son algunas de las zonas más afectadas y olvidadas. Con la acumulación de basura, los vecinos están afectados por malos olores y moscas. Además, la situación se presta para que algunas personas se dediquen a la recolección de basura informal, quienes botan los desechos en los terrenos baldíos de las comunidades generando una especie de vertederos que aumentan la contaminación y proliferación de insectos. Exigen a la administración del municipio Palavecino que active los camiones recolectores de basura y cumplan con el deber de mantener la ciudad y las comunidades limpias.  ",https://www.elimpulso.com/2020/08/24/caburenos-colapsan-entre-la-basura-y-la-contaminacion-24ago/
"Desde hace tres semanas los vecinos diversas comunidades de Cabudare no han visto los camiones recolectores del servicio de aseo urbano del Municipio Palavecino, lo que ha generado grandes cúmulos de basura dentro de las casas, aceras y avenidas de los urbanismos. La comunidades de La Puerta Norte y Sur, La Piedad, La Mora, El Trigal, Almarriera y El Recreo son algunas de las zonas más afectadas y olvidadas. Con la acumulación de basura, los vecinos están afectados por malos olores y moscas. Además, la situación se presta para que algunas personas se dediquen a la recolección de basura informal, quienes botan los desechos en los terrenos baldíos de las comunidades generando una especie de vertederos que aumentan la contaminación y proliferación de insectos. Exigen a la administración del municipio Palavecino que active los camiones recolectores de basura y cumplan con el deber de mantener la ciudad y las comunidades limpias.  ",https://www.elimpulso.com/2020/08/24/caburenos-colapsan-entre-la-basura-y-la-contaminacion-24ago/
"La semana del 17 al 23 de agosto, hubo disminución del racionamiento, tanto en frecuencia como en duración de los cortes, según datos recabados por Elimpulso.com en colaboración con la sociedad civil Activos por la Luz @activosporlaluz. Esta semana El Kilovatín de Oro vuelve a Cabudare con el podio completo. El primer lugar es para la zona de La Mata Norte/Intercomunal hasta Los Rastrojos, por haber acumulado 23,02 horas sin luz. Su día más extenso fue el sábado cuando tuvieron 9 horas sin electricidad, producto de doble dosis de racionamiento. En el segundo lugar se lo lleva Las Acacias. Acumularon 20,18 horas en la semana sin luz, producto de 4 días de cortes que iban desde 2 hasta 6 horas. El jueves fue período más largo con 6 horas y 8 minutos. El arrase de Cabudare lo completa la zona de Las Cuibas, Los Cipreses, y vía Agua Viva. Estuvieron a punto de quedarse con el segundo lugar. Sumaron 20,15 horas sin fluido eléctrico y tuvieron que conformase con el tercer puesto. El Kilovatín de Oro solo destaca tres comunidades a la semana, pero Barquisimeto y Cabudare siguen con fuertes cortes eléctricos. Jesús Saavedra, integrante del movimiento ciudadano “Activos por la Luz”, comentó recientemente para el Elimpulso.com que con el descontrol existente por el racionamiento más del 90% de los hogares hayan sufrido daños en sus electrodomésticos. “No sabemos cuándo pasará y ni cuánto tiempo durará” comentó. El premio Kilovatín se otorga cada lunes. Es un galardón que nadie quiere ganarse, porque se entrega a la comunidad que ha sufrido más horas sin electricidad en la última semana. Usted puede postular su comunidad e informar cuántas horas se queda sin electricidad a través del Twitter en la cuenta @activosporlaluz. ",https://www.elimpulso.com/2020/08/24/infografiaimp-3-comunidades-de-cabudare-fueron-las-mas-afectadas-por-cortes-de-luz/
"La semana del 17 al 23 de agosto, hubo disminución del racionamiento, tanto en frecuencia como en duración de los cortes, según datos recabados por Elimpulso.com en colaboración con la sociedad civil Activos por la Luz @activosporlaluz. Esta semana El Kilovatín de Oro vuelve a Cabudare con el podio completo. El primer lugar es para la zona de La Mata Norte/Intercomunal hasta Los Rastrojos, por haber acumulado 23,02 horas sin luz. Su día más extenso fue el sábado cuando tuvieron 9 horas sin electricidad, producto de doble dosis de racionamiento. En el segundo lugar se lo lleva Las Acacias. Acumularon 20,18 horas en la semana sin luz, producto de 4 días de cortes que iban desde 2 hasta 6 horas. El jueves fue período más largo con 6 horas y 8 minutos. El arrase de Cabudare lo completa la zona de Las Cuibas, Los Cipreses, y vía Agua Viva. Estuvieron a punto de quedarse con el segundo lugar. Sumaron 20,15 horas sin fluido eléctrico y tuvieron que conformase con el tercer puesto. El Kilovatín de Oro solo destaca tres comunidades a la semana, pero Barquisimeto y Cabudare siguen con fuertes cortes eléctricos. Jesús Saavedra, integrante del movimiento ciudadano “Activos por la Luz”, comentó recientemente para el Elimpulso.com que con el descontrol existente por el racionamiento más del 90% de los hogares hayan sufrido daños en sus electrodomésticos. “No sabemos cuándo pasará y ni cuánto tiempo durará” comentó. El premio Kilovatín se otorga cada lunes. Es un galardón que nadie quiere ganarse, porque se entrega a la comunidad que ha sufrido más horas sin electricidad en la última semana. Usted puede postular su comunidad e informar cuántas horas se queda sin electricidad a través del Twitter en la cuenta @activosporlaluz. ",https://www.elimpulso.com/2020/08/24/infografiaimp-3-comunidades-de-cabudare-fueron-las-mas-afectadas-por-cortes-de-luz/
"En estado de emergencia por la quema de uno de los motores de la represa Los Quediches declaró a Carora, Edgar Manuel Carrasco, a través de su programa de radio. Dijo que luego que Hidrolara, la Alcaldía y Corpoelec culminaron la parada de cuatro días por trabajos que consistieron en eliminación de filtraciones, sustitución de tuberías y acometida del sistema eléctrico en un tramo de la aducción Los Quediches-Carora que abastece de agua a la red media o zona centro y le red baja o zona oeste del municipio Torres. Aseguró haber sido informado que el motor 3 se quemó en la referida represa, quedando solamente dos motores funcionando. Sostuvo que de esta manera la represa queda sin la capacidad de poder bombear agua hasta un tanque en la Planta de Tratamiento de Carora, desde donde es dirigida hasta los hogares de las mencionadas redes, que llevan una semana sin el vital líquido a propósito de estas reparaciones. Pero además sin la esperanza de recibir agua por camiones cisternas ya que el llenadero quedó afectado por el problema. Reiteró que declara a Carora en emergencia hasta encontrar la solución de esta nueva avería con una empresa que repara este tipo de motor para que le coloque unos rodamientos que necesita. Indicó que mientras tanto se mantendrán encendidos los dos motores que proporcionarán agua solamente a poblaciones asentadas en la vía Quediches-Carora. Parada en Atarigua Adelantó que esta semana harán una parada en la represa de Atarigua para corregir filtraciones, rumbo a al rebobinado de la bomba 1, de 600 HP, para ponerla a trabajar con la bomba 2, porque la bomba 3 trabaja al 50% de su capacidad. Recordó que el sistema eléctrico de esta represa que le lleva agua a la parte alta de Carora, trabaja forzado con un solo transformador, porque el otro de 1.500 KVA está dañado. Alcaldía sin capacidad en materia hídrica Una fuente vinculada a Hidrolara indicó que a la alcaldía de Torres se le fue de las manos la problemática del agua en Carora y que el sistema tiene que volver a pasar a manos de la hidrológica de Lara. La Alcaldía no tiene personal idóneo para mantener las operaciones de la red hídrica, y no cuenta con ingenieros capacitados que se ocupen de todo el sistema de mantenimiento, expuso. Respecto al motor quemado en Los Quediches, agregó que ocurrió por la falta por parte de la Alcaldía de la asignación permanente de un ingeniero mecánico que lo haya evitado, como lo hacía Hidrolara, ente estadal que le entregó al municipio Torres el manejo de estas operaciones, que han venido desmejorando el sistema de distribución de agua a Carora.  ",https://www.elimpulso.com/2020/08/24/edgar-carrasco-declara-a-carora-en-emergencia-por-falta-de-agua/
"Cada vez que llueve, los habitantes de sectores como la Cañada Virginia, La Lago y Don Bosco sacan sus pipas a la calle para poder recolectar agua de lluvia y mantener la higiene de sus hogares, cocinar y hasta beber. Durante la mañana de este miércoles 26 de agosto otra vez les tocó abastecerse de la lluvia que cayó de sus techos, ante la incertidumbre de no saber cuándo les llegará el servicio por tubería. “Esto es una cosa de locos, al menos pude agarrar agua del cielo para usar en el baño y lavar ropa. Sin dudas gracias a Dios, porque por si es por Hidrolago, seguimos secos, son unos irresponsables”, expresó Deyanira González de Don Bosco. Además, la queja más difundida es que la mayoría debe trasladarse a pie a otros sectores para recolectar agua en tuberías madre o tomas ilegales, incluso de las orillas del Lago de Maracaibo. Denuncian que han pasado más de 30 días sin agua y se ven rodeados de camiones cisternas, que son los únicos que tienen acceso al agua “a precios difícilmente pagables”. En la Cañada Virginia más de 250 familias están afectadas y que tienen que ingeniárselas para poder acceder al agua. Sus métodos van desde recurrir a los edificios en construcción hasta establecimientos comerciales para surtirse con unos pocos litros. “Hay niños, ancianos y personas con discapacidad por las que velamos y necesitan usar el agua con frecuencia, tenemos que carretear agua en muchas ocasiones por kilómetros. Un día podemos llenar solo un botellón y no alcanza para todos”, expresó Dona Romero. Para leer más: http://www.laverdad.com/ ",https://www.elimpulso.com/2020/08/27/marabinos-recogen-agua-de-lluvia-para-cocinar-y-beber-27ago/
"No pasó un mes desde que Corpoelec reparó un transformador en el Barrio Japón 2 de Barquisimeto, cuando este volvió a explotar y dejó sin electricidad a unas 60 familias que allí residen. Así lo denunciaron vecinos del sector a Elimpulso.com, quienes ya tienen 6 días sin contar con el servicio de suministro eléctrico en sus hogares. Tras lo ocurrido, Corpoelec hizo presencia en el lugar para desmontar el transformador, seguidamente fue llevado hasta la sede en la Zona Industrial para su revisión y diagnóstico. No obstante, tras varios días en chequeo, estos informaron a la comunidad que pese a los esfuerzos de recuperación difícilmente garanticen la pronta instalación debido a los fuertes daños que sufrió. Lea: ¿Y Corpoelec? Barrio Japón está sin luz desde hace días por explosión de transformador #4Ago Agrega Corpoelec que tengan “paciencia” ante la situación. Los consultados por el equipo periodístico señalan que la ausencia del gas doméstico en el sector les ha obligado a la mayoría a preparar sus comidas con cocina eléctrica, por lo que ahora han quedado sin opciones y deben buscar alternativas para alimentarse, bien sea buscando leña o yendo a otras comunidades. Ante esto, exigen una pronta respuesta y apoyo por parte de las autoridades. ",https://www.elimpulso.com/2020/09/03/otra-vez-explosion-de-transformador-dejo-sin-electricidad-a-60-familias-en-barrio-japon-3sep/
